{
  "description": "Race's view: what clients receive, computed from the new state on every evaluation. Only what the clients show. Times are epoch ms on the device clock; speeds knots; headings degrees true.",
  "type": "object",
  "required": [
    "phase",
    "line"
  ],
  "properties": {
    "phase": {
      "description": "Where the race is, which picks the clients' page: exactly one of idle, countdown (to the gun) and racing (since the gun). The gun is what the countdown counts to and the race clock counts from.",
      "oneOf": [
        {
          "properties": {
            "idle": {
              "type": "object"
            }
          },
          "required": [
            "idle"
          ]
        },
        {
          "properties": {
            "countdown": {
              "type": "object",
              "required": [
                "gun"
              ],
              "properties": {
                "gun": {
                  "description": "the start",
                  "type": "integer",
                  "format": "int64"
                }
              }
            }
          },
          "required": [
            "countdown"
          ]
        },
        {
          "properties": {
            "racing": {
              "type": "object",
              "required": [
                "gun"
              ],
              "properties": {
                "gun": {
                  "description": "the start",
                  "type": "integer",
                  "format": "int64"
                }
              }
            }
          },
          "required": [
            "racing"
          ]
        }
      ]
    },
    "line": {
      "description": "Which ends of the start line are set, for the line buttons; with both, the clients show the time to the line instead. Shown while idle and counting down.",
      "type": "object",
      "required": [
        "stbd",
        "port"
      ],
      "properties": {
        "stbd": {
          "description": "the starboard end is set",
          "type": "boolean"
        },
        "port": {
          "description": "the port end is set",
          "type": "boolean"
        }
      }
    },
    "crossing": {
      "description": "when the boat reaches the line on its course, as last predicted, for the time to the line (from now while idle, from the gun while counting down); absent while racing and until the first prediction",
      "type": "integer",
      "format": "int64"
    },
    "speed": {
      "description": "speed over ground, shown in every phase; absent until the first GPS update with a velocity",
      "type": "number"
    },
    "heading": {
      "description": "course over ground, shown while racing; absent otherwise, and until the first GPS update with a velocity",
      "type": "number"
    }
  }
}
